ID,Candidate ID,Candidate Name,Title,Inventors,Patent Number,Year,Status
1,13,Zeeshan Father's/Guardian Abdul Hameed,Robust-DSN - Zeeshan Hameed; Hamid R. Barzegar; Nabil El Ioini; Claus Pahl ,"Zeeshan Hameed, Hamid R. Barzegar, Nabil El Ioini, Claus Pahl",,2023,
2,13,Zeeshan Father's/Guardian Abdul Hameed,Robust-DSN: A Hybrid Distributed Replication and Encoding Network,"Zeeshan Hameed, Hamid R. Barzegar, Nabil El Ioini, Claus Pahl",,2024,
3,14,Muhammad Farrukh,Untitled Patent,"Usama Iqbal, Daoliang Li, Usama Iqbal",,,
4,14,Muhammad Farrukh,Patent Title (Unknown),"Author 1, Author 2",,,
5,14,Muhammad Farrukh,"Digital Fuel Flow Sensor. Submitted by Qureshi, M.F., Khalid, S., Javaid, M.H.B., Nadeem, M.S., & Khan, H.M.",,,,
